<?xml version="1.0" encoding="UTF-8"?>

<menus xmlns="http://www.samskritiInfo.com"
    xmlns:xsi="http://www.w3.org/2001/XMLSchema-instance"
    xsi:schemaLocation="http://www.samskritiInfo.com menu.xsd">
    <menu name="Admin" id="1">
        <link/>
        <enabled>true</enabled>
        <display>true</display>
        <capability type="read"><name></name></capability>
        <menuItems>
            <menu name="Manage Users" id="1.1">
                <link>manageusers</link>
                <enabled>true</enabled>
                <display>true</display>
                <capability type="read"><name>USER</name></capability>
            </menu>
            <menu name="Manage Groups" id="1.2">
                <link>managegroups</link>
                <enabled>true</enabled>
                <display>true</display>
                <capability type="read"><name>GROUP</name></capability>
            </menu>
            <menu name="Manage Categories" id="1.2">
                <link>managecategories</link>
                <enabled>true</enabled>
                <display>true</display>
                <capability type="read"><name>CATEGORY</name></capability>
            </menu>
            <menu name="Manage Units" id="1.2">
                <link>manageunits</link>
                <enabled>true</enabled>
                <display>true</display>
                <capability type="read"><name>UNIT</name></capability>
            </menu>
			<menu name="Manage Items" id="1.2">
                <link>manageitems</link>
                <enabled>true</enabled>
                <display>true</display>
                <capability type="read"><name>ITEM</name></capability>
            </menu>
        </menuItems>
    </menu>
	<menu name="Sales" id="sales">
		<link/>
		<enabled>true</enabled>
		<display>true</display>
		<capability type="read"><name>SALES</name></capability>
		<menuItems>
			<menu name="Manage Orders" id="manageorders">
				<link>manageorders</link>
				<enabled>true</enabled>
				<display>true</display>
				<capability type="read"><name>ORDER</name></capability>
			</menu>
			<menu name="Manage Invoices" id="manageinvoices">
				<link>manageinvoices</link>
				<enabled>true</enabled>
				<display>true</display>
				<capability type="read"><name>INVOICE</name></capability>
			</menu>
		</menuItems>
	</menu>
    <menu name="Demo" id="demo">
        <link>demo</link>
        <enabled>true</enabled>
        <display>true</display>
        <capability type="read"><name></name></capability>
    </menu>
</menus>